{
  "schema_version": "1.0.0-draft",
  "programme_id": "SU-GRANTS-NIH-REPORTER-v0.1",
  "status": "NONCANONICAL_PROGRAMME_CONTROL",
  "source_universe_id": "SU-GRANTS",
  "source_system": "NIH_REPORTER_V2",
  "as_of": "2026-09-01",
  "provider_contract": {
    "provider": "NIH RePORTER API",
    "endpoint": "https://api.reporter.nih.gov/v2/projects/search",
    "method": "POST",
    "request_media_type": "application/json",
    "response_media_type": "application/json",
    "reported_denominator_path": "meta.total",
    "offset_path": "meta.offset",
    "limit_path": "meta.limit",
    "results_path": "results",
    "primary_application_id_field": "appl_id",
    "max_records_per_request": 500,
    "max_offset": 14999,
    "recommended_max_requests_per_second": 1,
    "configuration_performs_http": false
  },
  "workbench_dependency": {
    "minimum_package_line": "0.3.0.dev0",
    "required_capability": "project_nih_reporter_search_pages",
    "integration_state": "NOT_IMPLEMENTED"
  },
  "identity_policy": {
    "primary_identity": "NIH_REPORTER_APPL_ID",
    "application_id_auto_merge": false,
    "project_number_auto_merge": false,
    "core_project_lineage_auto_merge": false,
    "subproject_auto_parent_merge": false,
    "pi_name_auto_entity_merge": false,
    "organization_name_auto_entity_merge": false,
    "conflicting_same_appl_id_policy": "FAIL_CLOSED"
  },
  "inclusion_policy": {
    "candidate_scope": "DECLARED_ADVANCED_TEXT_SEARCH_MATCH",
    "automatic_grant_source_admission": false,
    "automatic_project_entity_creation": false,
    "automatic_pi_or_organization_entity_creation": false,
    "automatic_system_or_model_relationship_creation": false,
    "automatic_funding_success_claim_creation": false,
    "automatic_assessment_mutation": false,
    "automatic_monitor_creation": false,
    "human_relevance_review_required": true
  },
  "pagination_partition_policy": {
    "page_limit": 500,
    "initial_offset": 0,
    "max_offset": 14999,
    "max_directly_pageable_result_count": 15000,
    "over_limit_policy": "PARTITION_BEFORE_MATERIALIZATION",
    "preferred_partition_dimensions": ["FISCAL_YEAR", "AWARD_NOTICE_DATE"],
    "silent_truncation_allowed": false,
    "partial_over_limit_candidate_emission_allowed": false,
    "partition_provenance_required": true
  },
  "incremental_refresh_policy": {
    "cadence": "MONTHLY",
    "preferred_watermark": "date_added",
    "date_added_documented_from": "2011-01-01",
    "watermark_does_not_replace_historical_baseline": true
  },
  "query_streams": [
    {
      "query_id": "DISCOVERY-REPORTER-BCI-001",
      "advanced_text_search": {"operator": "or", "search_field": "projecttitle,abstracttext,terms", "search_text": "\"brain-computer interface\" \"brain computer interface\" \"brain-machine interface\""},
      "cadence": "MONTHLY",
      "status": "ACTIVE",
      "scope_tiers": ["A"],
      "purpose": "Explicit BCI and brain-machine-interface funded-project discovery.",
      "completeness_claim": false
    },
    {
      "query_id": "DISCOVERY-REPORTER-NEURAL-DECODING-AI-001",
      "advanced_text_search": {"operator": "advanced", "search_field": "projecttitle,abstracttext,terms", "search_text": "(neural OR cortical OR brain) AND (decoder OR decoding) AND (machine learning OR deep learning OR artificial intelligence OR transformer)"},
      "cadence": "MONTHLY",
      "status": "ACTIVE",
      "scope_tiers": ["A", "B"],
      "purpose": "AI-enabled neural-decoding grants that may not use BCI terminology.",
      "completeness_claim": false
    },
    {
      "query_id": "DISCOVERY-REPORTER-CLOSED-LOOP-NEUROMODULATION-001",
      "advanced_text_search": {"operator": "advanced", "search_field": "projecttitle,abstracttext,terms", "search_text": "(deep brain stimulation OR neuromodulation OR neurostimulation) AND (adaptive OR closed loop) AND (algorithm OR machine learning OR prediction)"},
      "cadence": "MONTHLY",
      "status": "ACTIVE",
      "scope_tiers": ["A"],
      "purpose": "Adaptive and algorithmically controlled neuromodulation funding.",
      "completeness_claim": false
    },
    {
      "query_id": "DISCOVERY-REPORTER-EEG-MODELS-001",
      "advanced_text_search": {"operator": "advanced", "search_field": "projecttitle,abstracttext,terms", "search_text": "(EEG OR electroencephalography) AND (foundation model OR transformer OR self supervised OR representation learning)"},
      "cadence": "MONTHLY",
      "status": "ACTIVE",
      "scope_tiers": ["A", "B"],
      "purpose": "EEG model and representation-learning funding discovery.",
      "completeness_claim": false
    },
    {
      "query_id": "DISCOVERY-REPORTER-SPEECH-NEUROPROSTHESIS-001",
      "advanced_text_search": {"operator": "advanced", "search_field": "projecttitle,abstracttext,terms", "search_text": "(brain OR neural OR cortical) AND (speech OR communication) AND (decoder OR decoding OR neuroprosthesis)"},
      "cadence": "MONTHLY",
      "status": "ACTIVE",
      "scope_tiers": ["A"],
      "purpose": "Speech and communication neuroprosthesis funding discovery.",
      "completeness_claim": false
    },
    {
      "query_id": "DISCOVERY-REPORTER-VISUAL-NEUROPROSTHESIS-001",
      "advanced_text_search": {"operator": "advanced", "search_field": "projecttitle,abstracttext,terms", "search_text": "(retinal OR retina OR visual cortex) AND (prosthesis OR neuroprosthesis OR implant) AND (algorithm OR image processing OR machine learning)"},
      "cadence": "QUARTERLY",
      "status": "ACTIVE",
      "scope_tiers": ["A", "B"],
      "purpose": "Visual and retinal neuroprosthesis funding with computational-role terms.",
      "completeness_claim": false
    },
    {
      "query_id": "DISCOVERY-REPORTER-GREY-MENTAL-STATE-001",
      "advanced_text_search": {"operator": "advanced", "search_field": "projecttitle,abstracttext,terms", "search_text": "(EEG OR electroencephalography OR neural OR brain signal) AND (attention OR emotion OR fatigue OR cognitive state OR mental state) AND (classification OR prediction OR inference OR machine learning)"},
      "cadence": "QUARTERLY",
      "status": "ACTIVE",
      "scope_tiers": ["C"],
      "purpose": "Grey-area funding discovery for neural-derived attention, emotion, fatigue, cognitive-state or mental-state inference.",
      "completeness_claim": false
    }
  ],
  "candidate_projection": {
    "required_fields": [
      "appl_id",
      "project_num",
      "core_project_num",
      "subproject_id",
      "fiscal_year",
      "project_title",
      "abstract_text",
      "project_start_date",
      "project_end_date",
      "award_notice_date",
      "award_amount",
      "funding_mechanism",
      "agency_ic_admin",
      "organization",
      "principal_investigators",
      "query_memberships",
      "normalized_record_sha256"
    ],
    "raw_api_pages_emitted_to_s2": false,
    "pi_or_org_entity_relationships_created_in_projection": false,
    "award_amount_interpreted_as_research_success": false
  },
  "coverage_contract": {
    "required_metrics_per_leaf_query": [
      "supplied_page_count",
      "returned_record_count",
      "unique_appl_id_count",
      "reported_total_count",
      "reported_total_count_state",
      "offset_sequence_valid",
      "offset_coverage_state",
      "over_15000_limit",
      "partition_required",
      "known_controlled_duplicate_count",
      "new_candidate_count",
      "duplicate_representation_count",
      "unresolved_appl_id_count"
    ],
    "mechanical_completion_requires": {
      "reported_total_count_state": "CONSISTENT",
      "offset_sequence_valid": true,
      "offset_coverage_state": "MATCH",
      "over_15000_limit": false,
      "partition_required": false
    },
    "reporter_database_completeness_claim": false,
    "global_neuroai_grant_recall_claim": false,
    "query_recall_claim": false,
    "funding_success_claim": false
  },
  "human_review_contract": {
    "required_dispositions": ["ACCEPT", "REJECT", "DEFER", "EXCLUDE"],
    "review_questions": [
      "Is the funded project materially relevant to direct NeuroAI, enabling infrastructure or the declared grey-area capability?",
      "Is the application identity exact and distinct from project/core-project lineage?",
      "Can PI and recipient organization identities be resolved without name-only automatic merging?",
      "What exact relationship to a represented system, model, dataset or institution is supported by the award record?",
      "What inference is prohibited by the award record alone?"
    ],
    "automatic_acceptance": false,
    "award_is_research_success_evidence": false,
    "award_is_system_effectiveness_evidence": false,
    "award_is_commercial_strength_evidence": false
  },
  "network_policy": {
    "live_execution": "OPT_IN_ONLY",
    "requires_workbench_network_gate": true,
    "recommended_max_requests_per_second": 1,
    "large_job_schedule_guidance_preserved": true,
    "configuration_performs_http": false,
    "hosted_success_claim_allowed_without_runner_steps": false
  },
  "boundary": "This programme defines bounded NIH RePORTER-funded-project discovery. An award record establishes a public funding/project record within the provider data; it does not establish research success, scientific validity, system effectiveness, commercialization, current implementation, ethical acceptability, regulatory authorization, system conformance, global grant completeness or UNESCO/institutional endorsement."
}
